Frame 171: 109 bytes on wire (872 bits), 109 bytes captured (872 bits) on interface 0
    Interface id: 0 (lo0)
        Interface name: lo0
    Encapsulation type: NULL/Loopback (15)
    Arrival Time: Jul 25, 2019 22:33:35.975069000 CEST
    [Time shift for this packet: 0.000000000 seconds]
    Epoch Time: 1564086815.975069000 seconds
    [Time delta from previous captured frame: 0.011347000 seconds]
    [Time delta from previous displayed frame: 0.000000000 seconds]
    [Time since reference or first frame: 15.239031000 seconds]
    Frame Number: 171
    Frame Length: 109 bytes (872 bits)
    Capture Length: 109 bytes (872 bits)
    [Frame is marked: False]
    [Frame is ignored: False]
    [Protocols in frame: null:ip:tcp:tls:http2]
    [Coloring Rule Name: HTTP]
    [Coloring Rule String: http || tcp.port == 80 || http2]
Null/Loopback
    Family: IP (2)
Internet Protocol Version 4, Src: 127.0.0.1, Dst: 127.0.0.1
    0100 .... = Version: 4
    .... 0101 = Header Length: 20 bytes (5)
    Differentiated Services Field: 0x00 (DSCP: CS0, ECN: Not-ECT)
        0000 00.. = Differentiated Services Codepoint: Default (0)
        .... ..00 = Explicit Congestion Notification: Not ECN-Capable Transport (0)
    Total Length: 105
    Identification: 0x0000 (0)
    Flags: 0x4000, Don't fragment
        0... .... .... .... = Reserved bit: Not set
        .1.. .... .... .... = Don't fragment: Set
        ..0. .... .... .... = More fragments: Not set
        ...0 0000 0000 0000 = Fragment offset: 0
    Time to live: 64
    Protocol: TCP (6)
    Header checksum: 0x0000 [validation disabled]
    [Header checksum status: Unverified]
    Source: 127.0.0.1
    Destination: 127.0.0.1
Transmission Control Protocol, Src Port: 54699, Dst Port: 8443, Seq: 288, Ack: 1389, Len: 53
    Source Port: 54699
    Destination Port: 8443
    [Stream index: 68]
    [TCP Segment Len: 53]
    Sequence number: 288    (relative sequence number)
    [Next sequence number: 341    (relative sequence number)]
    Acknowledgment number: 1389    (relative ack number)
    1000 .... = Header Length: 32 bytes (8)
    Flags: 0x018 (PSH, ACK)
        000. .... .... = Reserved: Not set
        ...0 .... .... = Nonce: Not set
        .... 0... .... = Congestion Window Reduced (CWR): Not set
        .... .0.. .... = ECN-Echo: Not set
        .... ..0. .... = Urgent: Not set
        .... ...1 .... = Acknowledgment: Set
        .... .... 1... = Push: Set
        .... .... .0.. = Reset: Not set
        .... .... ..0. = Syn: Not set
        .... .... ...0 = Fin: Not set
        [TCP Flags: ·······AP···]
    Window size value: 6358
    [Calculated window size: 406912]
    [Window size scaling factor: 64]
    Checksum: 0xfe5d [unverified]
    [Checksum Status: Unverified]
    Urgent pointer: 0
    Options: (12 bytes), No-Operation (NOP), No-Operation (NOP), Timestamps
        TCP Option - No-Operation (NOP)
            Kind: No-Operation (1)
        TCP Option - No-Operation (NOP)
            Kind: No-Operation (1)
        TCP Option - Timestamps: TSval 1333672917, TSecr 1333672905
            Kind: Time Stamp Option (8)
            Length: 10
            Timestamp value: 1333672917
            Timestamp echo reply: 1333672905
    [SEQ/ACK analysis]
        [iRTT: 0.000102000 seconds]
        [Bytes in flight: 53]
        [Bytes sent since last PSH flag: 53]
    [Timestamps]
        [Time since first frame in this TCP stream: 0.165370000 seconds]
        [Time since previous frame in this TCP stream: 0.011864000 seconds]
    TCP payload (53 bytes)
    [PDU Size: 24]
Transport Layer Security
    TLSv1.2 Record Layer: Application Data Protocol: http2
        Content Type: Application Data (23)
        Version: TLS 1.2 (0x0303)
        Length: 48
        Encrypted Application Data: 0000000000000001c23909d4c1dedc93a81abf9ab8a6e880…
HyperText Transfer Protocol 2
    Stream: Magic
        Magic: PRI * HTTP/2.0\r\n\r\nSM\r\n\r\n

Frame 173: 100 bytes on wire (800 bits), 100 bytes captured (800 bits) on interface 0
    Interface id: 0 (lo0)
        Interface name: lo0
    Encapsulation type: NULL/Loopback (15)
    Arrival Time: Jul 25, 2019 22:33:35.975280000 CEST
    [Time shift for this packet: 0.000000000 seconds]
    Epoch Time: 1564086815.975280000 seconds
    [Time delta from previous captured frame: 0.000146000 seconds]
    [Time delta from previous displayed frame: 0.000211000 seconds]
    [Time since reference or first frame: 15.239242000 seconds]
    Frame Number: 173
    Frame Length: 100 bytes (800 bits)
    Capture Length: 100 bytes (800 bits)
    [Frame is marked: False]
    [Frame is ignored: False]
    [Protocols in frame: null:ip:tcp:tls:http2]
    [Coloring Rule Name: HTTP]
    [Coloring Rule String: http || tcp.port == 80 || http2]
Null/Loopback
    Family: IP (2)
Internet Protocol Version 4, Src: 127.0.0.1, Dst: 127.0.0.1
    0100 .... = Version: 4
    .... 0101 = Header Length: 20 bytes (5)
    Differentiated Services Field: 0x00 (DSCP: CS0, ECN: Not-ECT)
        0000 00.. = Differentiated Services Codepoint: Default (0)
        .... ..00 = Explicit Congestion Notification: Not ECN-Capable Transport (0)
    Total Length: 96
    Identification: 0x0000 (0)
    Flags: 0x4000, Don't fragment
        0... .... .... .... = Reserved bit: Not set
        .1.. .... .... .... = Don't fragment: Set
        ..0. .... .... .... = More fragments: Not set
        ...0 0000 0000 0000 = Fragment offset: 0
    Time to live: 64
    Protocol: TCP (6)
    Header checksum: 0x0000 [validation disabled]
    [Header checksum status: Unverified]
    Source: 127.0.0.1
    Destination: 127.0.0.1
Transmission Control Protocol, Src Port: 54699, Dst Port: 8443, Seq: 341, Ack: 1389, Len: 44
    Source Port: 54699
    Destination Port: 8443
    [Stream index: 68]
    [TCP Segment Len: 44]
    Sequence number: 341    (relative sequence number)
    [Next sequence number: 385    (relative sequence number)]
    Acknowledgment number: 1389    (relative ack number)
    1000 .... = Header Length: 32 bytes (8)
    Flags: 0x018 (PSH, ACK)
        000. .... .... = Reserved: Not set
        ...0 .... .... = Nonce: Not set
        .... 0... .... = Congestion Window Reduced (CWR): Not set
        .... .0.. .... = ECN-Echo: Not set
        .... ..0. .... = Urgent: Not set
        .... ...1 .... = Acknowledgment: Set
        .... .... 1... = Push: Set
        .... .... .0.. = Reset: Not set
        .... .... ..0. = Syn: Not set
        .... .... ...0 = Fin: Not set
        [TCP Flags: ·······AP···]
    Window size value: 6358
    [Calculated window size: 406912]
    [Window size scaling factor: 64]
    Checksum: 0xfe54 [unverified]
    [Checksum Status: Unverified]
    Urgent pointer: 0
    Options: (12 bytes), No-Operation (NOP), No-Operation (NOP), Timestamps
        TCP Option - No-Operation (NOP)
            Kind: No-Operation (1)
        TCP Option - No-Operation (NOP)
            Kind: No-Operation (1)
        TCP Option - Timestamps: TSval 1333672917, TSecr 1333672917
            Kind: Time Stamp Option (8)
            Length: 10
            Timestamp value: 1333672917
            Timestamp echo reply: 1333672917
    [SEQ/ACK analysis]
        [iRTT: 0.000102000 seconds]
        [Bytes in flight: 44]
        [Bytes sent since last PSH flag: 44]
    [Timestamps]
        [Time since first frame in this TCP stream: 0.165581000 seconds]
        [Time since previous frame in this TCP stream: 0.000146000 seconds]
    TCP payload (44 bytes)
    [PDU Size: 15]
Transport Layer Security
    TLSv1.2 Record Layer: Application Data Protocol: http2
        Content Type: Application Data (23)
        Version: TLS 1.2 (0x0303)
        Length: 39
        Encrypted Application Data: 000000000000000247a826d791e84ec76e30aa4a4635726b…
HyperText Transfer Protocol 2
    Stream: SETTINGS, Stream ID: 0, Length 6
        Length: 6
        Type: SETTINGS (4)
        Flags: 0x00
            .... ...0 = ACK: False
            0000 000. = Unused: 0x00
        0... .... .... .... .... .... .... .... = Reserved: 0x0
        .000 0000 0000 0000 0000 0000 0000 0000 = Stream Identifier: 0
        Settings - Initial Windows size : 16777216
            Settings Identifier: Initial Windows size (4)
            Initial Windows Size: 16777216

Frame 175: 98 bytes on wire (784 bits), 98 bytes captured (784 bits) on interface 0
    Interface id: 0 (lo0)
        Interface name: lo0
    Encapsulation type: NULL/Loopback (15)
    Arrival Time: Jul 25, 2019 22:33:35.975403000 CEST
    [Time shift for this packet: 0.000000000 seconds]
    Epoch Time: 1564086815.975403000 seconds
    [Time delta from previous captured frame: 0.000101000 seconds]
    [Time delta from previous displayed frame: 0.000123000 seconds]
    [Time since reference or first frame: 15.239365000 seconds]
    Frame Number: 175
    Frame Length: 98 bytes (784 bits)
    Capture Length: 98 bytes (784 bits)
    [Frame is marked: False]
    [Frame is ignored: False]
    [Protocols in frame: null:ip:tcp:tls:http2]
    [Coloring Rule Name: HTTP]
    [Coloring Rule String: http || tcp.port == 80 || http2]
Null/Loopback
    Family: IP (2)
Internet Protocol Version 4, Src: 127.0.0.1, Dst: 127.0.0.1
    0100 .... = Version: 4
    .... 0101 = Header Length: 20 bytes (5)
    Differentiated Services Field: 0x00 (DSCP: CS0, ECN: Not-ECT)
        0000 00.. = Differentiated Services Codepoint: Default (0)
        .... ..00 = Explicit Congestion Notification: Not ECN-Capable Transport (0)
    Total Length: 94
    Identification: 0x0000 (0)
    Flags: 0x4000, Don't fragment
        0... .... .... .... = Reserved bit: Not set
        .1.. .... .... .... = Don't fragment: Set
        ..0. .... .... .... = More fragments: Not set
        ...0 0000 0000 0000 = Fragment offset: 0
    Time to live: 64
    Protocol: TCP (6)
    Header checksum: 0x0000 [validation disabled]
    [Header checksum status: Unverified]
    Source: 127.0.0.1
    Destination: 127.0.0.1
Transmission Control Protocol, Src Port: 54699, Dst Port: 8443, Seq: 385, Ack: 1389, Len: 42
    Source Port: 54699
    Destination Port: 8443
    [Stream index: 68]
    [TCP Segment Len: 42]
    Sequence number: 385    (relative sequence number)
    [Next sequence number: 427    (relative sequence number)]
    Acknowledgment number: 1389    (relative ack number)
    1000 .... = Header Length: 32 bytes (8)
    Flags: 0x018 (PSH, ACK)
        000. .... .... = Reserved: Not set
        ...0 .... .... = Nonce: Not set
        .... 0... .... = Congestion Window Reduced (CWR): Not set
        .... .0.. .... = ECN-Echo: Not set
        .... ..0. .... = Urgent: Not set
        .... ...1 .... = Acknowledgment: Set
        .... .... 1... = Push: Set
        .... .... .0.. = Reset: Not set
        .... .... ..0. = Syn: Not set
        .... .... ...0 = Fin: Not set
        [TCP Flags: ·······AP···]
    Window size value: 6358
    [Calculated window size: 406912]
    [Window size scaling factor: 64]
    Checksum: 0xfe52 [unverified]
    [Checksum Status: Unverified]
    Urgent pointer: 0
    Options: (12 bytes), No-Operation (NOP), No-Operation (NOP), Timestamps
        TCP Option - No-Operation (NOP)
            Kind: No-Operation (1)
        TCP Option - No-Operation (NOP)
            Kind: No-Operation (1)
        TCP Option - Timestamps: TSval 1333672917, TSecr 1333672917
            Kind: Time Stamp Option (8)
            Length: 10
            Timestamp value: 1333672917
            Timestamp echo reply: 1333672917
    [SEQ/ACK analysis]
        [iRTT: 0.000102000 seconds]
        [Bytes in flight: 42]
        [Bytes sent since last PSH flag: 42]
    [Timestamps]
        [Time since first frame in this TCP stream: 0.165704000 seconds]
        [Time since previous frame in this TCP stream: 0.000101000 seconds]
    TCP payload (42 bytes)
    [PDU Size: 13]
Transport Layer Security
    TLSv1.2 Record Layer: Application Data Protocol: http2
        Content Type: Application Data (23)
        Version: TLS 1.2 (0x0303)
        Length: 37
        Encrypted Application Data: 0000000000000003d7ddfde33e536c7e44a068d70d94947d…
HyperText Transfer Protocol 2
    Stream: WINDOW_UPDATE, Stream ID: 0, Length 4
        Length: 4
        Type: WINDOW_UPDATE (8)
        Flags: 0x00
            0000 0000 = Unused: 0x00
        0... .... .... .... .... .... .... .... = Reserved: 0x0
        .000 0000 0000 0000 0000 0000 0000 0000 = Stream Identifier: 0
        0... .... .... .... .... .... .... .... = Reserved: 0x0
        .000 0000 1111 1111 0000 0000 0000 0001 = Window Size Increment: 16711681

Frame 177: 126 bytes on wire (1008 bits), 126 bytes captured (1008 bits) on interface 0
    Interface id: 0 (lo0)
        Interface name: lo0
    Encapsulation type: NULL/Loopback (15)
    Arrival Time: Jul 25, 2019 22:33:35.982578000 CEST
    [Time shift for this packet: 0.000000000 seconds]
    Epoch Time: 1564086815.982578000 seconds
    [Time delta from previous captured frame: 0.007160000 seconds]
    [Time delta from previous displayed frame: 0.007175000 seconds]
    [Time since reference or first frame: 15.246540000 seconds]
    Frame Number: 177
    Frame Length: 126 bytes (1008 bits)
    Capture Length: 126 bytes (1008 bits)
    [Frame is marked: False]
    [Frame is ignored: False]
    [Protocols in frame: null:ip:tcp:tls:http2]
    [Coloring Rule Name: HTTP]
    [Coloring Rule String: http || tcp.port == 80 || http2]
Null/Loopback
    Family: IP (2)
Internet Protocol Version 4, Src: 127.0.0.1, Dst: 127.0.0.1
    0100 .... = Version: 4
    .... 0101 = Header Length: 20 bytes (5)
    Differentiated Services Field: 0x00 (DSCP: CS0, ECN: Not-ECT)
        0000 00.. = Differentiated Services Codepoint: Default (0)
        .... ..00 = Explicit Congestion Notification: Not ECN-Capable Transport (0)
    Total Length: 122
    Identification: 0x0000 (0)
    Flags: 0x4000, Don't fragment
        0... .... .... .... = Reserved bit: Not set
        .1.. .... .... .... = Don't fragment: Set
        ..0. .... .... .... = More fragments: Not set
        ...0 0000 0000 0000 = Fragment offset: 0
    Time to live: 64
    Protocol: TCP (6)
    Header checksum: 0x0000 [validation disabled]
    [Header checksum status: Unverified]
    Source: 127.0.0.1
    Destination: 127.0.0.1
Transmission Control Protocol, Src Port: 54699, Dst Port: 8443, Seq: 427, Ack: 1389, Len: 70
    Source Port: 54699
    Destination Port: 8443
    [Stream index: 68]
    [TCP Segment Len: 70]
    Sequence number: 427    (relative sequence number)
    [Next sequence number: 497    (relative sequence number)]
    Acknowledgment number: 1389    (relative ack number)
    1000 .... = Header Length: 32 bytes (8)
    Flags: 0x018 (PSH, ACK)
        000. .... .... = Reserved: Not set
        ...0 .... .... = Nonce: Not set
        .... 0... .... = Congestion Window Reduced (CWR): Not set
        .... .0.. .... = ECN-Echo: Not set
        .... ..0. .... = Urgent: Not set
        .... ...1 .... = Acknowledgment: Set
        .... .... 1... = Push: Set
        .... .... .0.. = Reset: Not set
        .... .... ..0. = Syn: Not set
        .... .... ...0 = Fin: Not set
        [TCP Flags: ·······AP···]
    Window size value: 6358
    [Calculated window size: 406912]
    [Window size scaling factor: 64]
    Checksum: 0xfe6e [unverified]
    [Checksum Status: Unverified]
    Urgent pointer: 0
    Options: (12 bytes), No-Operation (NOP), No-Operation (NOP), Timestamps
        TCP Option - No-Operation (NOP)
            Kind: No-Operation (1)
        TCP Option - No-Operation (NOP)
            Kind: No-Operation (1)
        TCP Option - Timestamps: TSval 1333672924, TSecr 1333672917
            Kind: Time Stamp Option (8)
            Length: 10
            Timestamp value: 1333672924
            Timestamp echo reply: 1333672917
    [SEQ/ACK analysis]
        [iRTT: 0.000102000 seconds]
        [Bytes in flight: 70]
        [Bytes sent since last PSH flag: 70]
    [Timestamps]
        [Time since first frame in this TCP stream: 0.172879000 seconds]
        [Time since previous frame in this TCP stream: 0.007160000 seconds]
    TCP payload (70 bytes)
    [PDU Size: 41]
Transport Layer Security
    TLSv1.2 Record Layer: Application Data Protocol: http2
        Content Type: Application Data (23)
        Version: TLS 1.2 (0x0303)
        Length: 65
        Encrypted Application Data: 0000000000000004998a0d6d2900aae358a70cc85f75a748…
HyperText Transfer Protocol 2
    Stream: HEADERS, Stream ID: 3, Length 32, GET /
        Length: 32
        Type: HEADERS (1)
        Flags: 0x05
            .... ...1 = End Stream: True
            .... .1.. = End Headers: True
            .... 0... = Padded: False
            ..0. .... = Priority: False
            00.0 ..0. = Unused: 0x00
        0... .... .... .... .... .... .... .... = Reserved: 0x0
        .000 0000 0000 0000 0000 0000 0000 0011 = Stream Identifier: 3
        [Pad Length: 0]
        Header Block Fragment: 8284418aa0e41d139d09b8f34d338750839bd9ab7a8a3f59…
        [Header Length: 142]
        [Header Count: 6]
        Header: :method: GET
            Name Length: 7
            Name: :method
            Value Length: 3
            Value: GET
            :method: GET
            [Unescaped: GET]
            Representation: Indexed Header Field
            Index: 2
        Header: :path: /
            Name Length: 5
            Name: :path
            Value Length: 1
            Value: /
            :path: /
            [Unescaped: /]
            Representation: Indexed Header Field
            Index: 4
        Header: :authority: localhost:8443
            Name Length: 10
            Name: :authority
            Value Length: 14
            Value: localhost:8443
            :authority: localhost:8443
            [Unescaped: localhost:8443]
            Representation: Literal Header Field with Incremental Indexing - Indexed Name
            Index: 1
        Header: :scheme: https
            Name Length: 7
            Name: :scheme
            Value Length: 5
            Value: https
            :scheme: https
            [Unescaped: https]
            Representation: Indexed Header Field
            Index: 7
        Header: accept-encoding: gzip
            Name Length: 15
            Name: accept-encoding
            Value Length: 4
            Value: gzip
            accept-encoding: gzip
            [Unescaped: gzip]
            Representation: Literal Header Field with Incremental Indexing - Indexed Name
            Index: 16
        Header: user-agent: okhttp/3.13.1
            Name Length: 10
            Name: user-agent
            Value Length: 13
            Value: okhttp/3.13.1
            user-agent: okhttp/3.13.1
            [Unescaped: okhttp/3.13.1]
            Representation: Literal Header Field with Incremental Indexing - Indexed Name
            Index: 58

Frame 179: 131 bytes on wire (1048 bits), 131 bytes captured (1048 bits) on interface 0
    Interface id: 0 (lo0)
        Interface name: lo0
    Encapsulation type: NULL/Loopback (15)
    Arrival Time: Jul 25, 2019 22:33:35.984990000 CEST
    [Time shift for this packet: 0.000000000 seconds]
    Epoch Time: 1564086815.984990000 seconds
    [Time delta from previous captured frame: 0.002346000 seconds]
    [Time delta from previous displayed frame: 0.002412000 seconds]
    [Time since reference or first frame: 15.248952000 seconds]
    Frame Number: 179
    Frame Length: 131 bytes (1048 bits)
    Capture Length: 131 bytes (1048 bits)
    [Frame is marked: False]
    [Frame is ignored: False]
    [Protocols in frame: null:ip:tcp:tls:http2]
    [Coloring Rule Name: HTTP]
    [Coloring Rule String: http || tcp.port == 80 || http2]
Null/Loopback
    Family: IP (2)
Internet Protocol Version 4, Src: 127.0.0.1, Dst: 127.0.0.1
    0100 .... = Version: 4
    .... 0101 = Header Length: 20 bytes (5)
    Differentiated Services Field: 0x00 (DSCP: CS0, ECN: Not-ECT)
        0000 00.. = Differentiated Services Codepoint: Default (0)
        .... ..00 = Explicit Congestion Notification: Not ECN-Capable Transport (0)
    Total Length: 127
    Identification: 0x0000 (0)
    Flags: 0x4000, Don't fragment
        0... .... .... .... = Reserved bit: Not set
        .1.. .... .... .... = Don't fragment: Set
        ..0. .... .... .... = More fragments: Not set
        ...0 0000 0000 0000 = Fragment offset: 0
    Time to live: 64
    Protocol: TCP (6)
    Header checksum: 0x0000 [validation disabled]
    [Header checksum status: Unverified]
    Source: 127.0.0.1
    Destination: 127.0.0.1
Transmission Control Protocol, Src Port: 8443, Dst Port: 54699, Seq: 1389, Ack: 497, Len: 75
    Source Port: 8443
    Destination Port: 54699
    [Stream index: 68]
    [TCP Segment Len: 75]
    Sequence number: 1389    (relative sequence number)
    [Next sequence number: 1464    (relative sequence number)]
    Acknowledgment number: 497    (relative ack number)
    1000 .... = Header Length: 32 bytes (8)
    Flags: 0x018 (PSH, ACK)
        000. .... .... = Reserved: Not set
        ...0 .... .... = Nonce: Not set
        .... 0... .... = Congestion Window Reduced (CWR): Not set
        .... .0.. .... = ECN-Echo: Not set
        .... ..0. .... = Urgent: Not set
        .... ...1 .... = Acknowledgment: Set
        .... .... 1... = Push: Set
        .... .... .0.. = Reset: Not set
        .... .... ..0. = Syn: Not set
        .... .... ...0 = Fin: Not set
        [TCP Flags: ·······AP···]
    Window size value: 6371
    [Calculated window size: 407744]
    [Window size scaling factor: 64]
    Checksum: 0xfe73 [unverified]
    [Checksum Status: Unverified]
    Urgent pointer: 0
    Options: (12 bytes), No-Operation (NOP), No-Operation (NOP), Timestamps
        TCP Option - No-Operation (NOP)
            Kind: No-Operation (1)
        TCP Option - No-Operation (NOP)
            Kind: No-Operation (1)
        TCP Option - Timestamps: TSval 1333672926, TSecr 1333672924
            Kind: Time Stamp Option (8)
            Length: 10
            Timestamp value: 1333672926
            Timestamp echo reply: 1333672924
    [SEQ/ACK analysis]
        [iRTT: 0.000102000 seconds]
        [Bytes in flight: 75]
        [Bytes sent since last PSH flag: 75]
    [Timestamps]
        [Time since first frame in this TCP stream: 0.175291000 seconds]
        [Time since previous frame in this TCP stream: 0.002346000 seconds]
    TCP payload (75 bytes)
    [PDU Size: 33]
    [PDU Size: 13]
Transport Layer Security
    TLSv1.2 Record Layer: Application Data Protocol: http2
        Content Type: Application Data (23)
        Version: TLS 1.2 (0x0303)
        Length: 70
        Encrypted Application Data: 0000000000000001a1b4945429df6c58ef8d4d9162434822…
HyperText Transfer Protocol 2
    Stream: SETTINGS, Stream ID: 0, Length 24
        Length: 24
        Type: SETTINGS (4)
        Flags: 0x00
            .... ...0 = ACK: False
            0000 000. = Unused: 0x00
        0... .... .... .... .... .... .... .... = Reserved: 0x0
        .000 0000 0000 0000 0000 0000 0000 0000 = Stream Identifier: 0
        Settings - Header table size : 4096
            Settings Identifier: Header table size (1)
            Header table size: 4096
        Settings - Max concurrent streams : 1024
            Settings Identifier: Max concurrent streams (3)
            Max concurrent streams: 1024
        Settings - Initial Windows size : 524288
            Settings Identifier: Initial Windows size (4)
            Initial Windows Size: 524288
        Settings - Max header list size : 8192
            Settings Identifier: Max header list size (6)
            Max header list size: 8192
    Stream: WINDOW_UPDATE, Stream ID: 0, Length 4
        Length: 4
        Type: WINDOW_UPDATE (8)
        Flags: 0x00
            0000 0000 = Unused: 0x00
        0... .... .... .... .... .... .... .... = Reserved: 0x0
        .000 0000 0000 0000 0000 0000 0000 0000 = Stream Identifier: 0
        0... .... .... .... .... .... .... .... = Reserved: 0x0
        .000 0000 0000 1111 0000 0000 0000 0001 = Window Size Increment: 983041

Frame 181: 94 bytes on wire (752 bits), 94 bytes captured (752 bits) on interface 0
    Interface id: 0 (lo0)
        Interface name: lo0
    Encapsulation type: NULL/Loopback (15)
    Arrival Time: Jul 25, 2019 22:33:35.986536000 CEST
    [Time shift for this packet: 0.000000000 seconds]
    Epoch Time: 1564086815.986536000 seconds
    [Time delta from previous captured frame: 0.001482000 seconds]
    [Time delta from previous displayed frame: 0.001546000 seconds]
    [Time since reference or first frame: 15.250498000 seconds]
    Frame Number: 181
    Frame Length: 94 bytes (752 bits)
    Capture Length: 94 bytes (752 bits)
    [Frame is marked: False]
    [Frame is ignored: False]
    [Protocols in frame: null:ip:tcp:tls:http2]
    [Coloring Rule Name: HTTP]
    [Coloring Rule String: http || tcp.port == 80 || http2]
Null/Loopback
    Family: IP (2)
Internet Protocol Version 4, Src: 127.0.0.1, Dst: 127.0.0.1
    0100 .... = Version: 4
    .... 0101 = Header Length: 20 bytes (5)
    Differentiated Services Field: 0x00 (DSCP: CS0, ECN: Not-ECT)
        0000 00.. = Differentiated Services Codepoint: Default (0)
        .... ..00 = Explicit Congestion Notification: Not ECN-Capable Transport (0)
    Total Length: 90
    Identification: 0x0000 (0)
    Flags: 0x4000, Don't fragment
        0... .... .... .... = Reserved bit: Not set
        .1.. .... .... .... = Don't fragment: Set
        ..0. .... .... .... = More fragments: Not set
        ...0 0000 0000 0000 = Fragment offset: 0
    Time to live: 64
    Protocol: TCP (6)
    Header checksum: 0x0000 [validation disabled]
    [Header checksum status: Unverified]
    Source: 127.0.0.1
    Destination: 127.0.0.1
Transmission Control Protocol, Src Port: 54699, Dst Port: 8443, Seq: 497, Ack: 1464, Len: 38
    Source Port: 54699
    Destination Port: 8443
    [Stream index: 68]
    [TCP Segment Len: 38]
    Sequence number: 497    (relative sequence number)
    [Next sequence number: 535    (relative sequence number)]
    Acknowledgment number: 1464    (relative ack number)
    1000 .... = Header Length: 32 bytes (8)
    Flags: 0x018 (PSH, ACK)
        000. .... .... = Reserved: Not set
        ...0 .... .... = Nonce: Not set
        .... 0... .... = Congestion Window Reduced (CWR): Not set
        .... .0.. .... = ECN-Echo: Not set
        .... ..0. .... = Urgent: Not set
        .... ...1 .... = Acknowledgment: Set
        .... .... 1... = Push: Set
        .... .... .0.. = Reset: Not set
        .... .... ..0. = Syn: Not set
        .... .... ...0 = Fin: Not set
        [TCP Flags: ·······AP···]
    Window size value: 6356
    [Calculated window size: 406784]
    [Window size scaling factor: 64]
    Checksum: 0xfe4e [unverified]
    [Checksum Status: Unverified]
    Urgent pointer: 0
    Options: (12 bytes), No-Operation (NOP), No-Operation (NOP), Timestamps
        TCP Option - No-Operation (NOP)
            Kind: No-Operation (1)
        TCP Option - No-Operation (NOP)
            Kind: No-Operation (1)
        TCP Option - Timestamps: TSval 1333672927, TSecr 1333672926
            Kind: Time Stamp Option (8)
            Length: 10
            Timestamp value: 1333672927
            Timestamp echo reply: 1333672926
    [SEQ/ACK analysis]
        [iRTT: 0.000102000 seconds]
        [Bytes in flight: 38]
        [Bytes sent since last PSH flag: 38]
    [Timestamps]
        [Time since first frame in this TCP stream: 0.176837000 seconds]
        [Time since previous frame in this TCP stream: 0.001482000 seconds]
    TCP payload (38 bytes)
    [PDU Size: 9]
Transport Layer Security
    TLSv1.2 Record Layer: Application Data Protocol: http2
        Content Type: Application Data (23)
        Version: TLS 1.2 (0x0303)
        Length: 33
        Encrypted Application Data: 00000000000000053cca4ab7a5f7261cfb01d7305b4b3ae2…
HyperText Transfer Protocol 2
    Stream: SETTINGS, Stream ID: 0, Length 0
        Length: 0
        Type: SETTINGS (4)
        Flags: 0x01
            .... ...1 = ACK: True
            0000 000. = Unused: 0x00
        0... .... .... .... .... .... .... .... = Reserved: 0x0
        .000 0000 0000 0000 0000 0000 0000 0000 = Stream Identifier: 0

Frame 183: 94 bytes on wire (752 bits), 94 bytes captured (752 bits) on interface 0
    Interface id: 0 (lo0)
        Interface name: lo0
    Encapsulation type: NULL/Loopback (15)
    Arrival Time: Jul 25, 2019 22:33:35.989428000 CEST
    [Time shift for this packet: 0.000000000 seconds]
    Epoch Time: 1564086815.989428000 seconds
    [Time delta from previous captured frame: 0.002851000 seconds]
    [Time delta from previous displayed frame: 0.002892000 seconds]
    [Time since reference or first frame: 15.253390000 seconds]
    Frame Number: 183
    Frame Length: 94 bytes (752 bits)
    Capture Length: 94 bytes (752 bits)
    [Frame is marked: False]
    [Frame is ignored: False]
    [Protocols in frame: null:ip:tcp:tls:http2]
    [Coloring Rule Name: HTTP]
    [Coloring Rule String: http || tcp.port == 80 || http2]
Null/Loopback
    Family: IP (2)
Internet Protocol Version 4, Src: 127.0.0.1, Dst: 127.0.0.1
    0100 .... = Version: 4
    .... 0101 = Header Length: 20 bytes (5)
    Differentiated Services Field: 0x00 (DSCP: CS0, ECN: Not-ECT)
        0000 00.. = Differentiated Services Codepoint: Default (0)
        .... ..00 = Explicit Congestion Notification: Not ECN-Capable Transport (0)
    Total Length: 90
    Identification: 0x0000 (0)
    Flags: 0x4000, Don't fragment
        0... .... .... .... = Reserved bit: Not set
        .1.. .... .... .... = Don't fragment: Set
        ..0. .... .... .... = More fragments: Not set
        ...0 0000 0000 0000 = Fragment offset: 0
    Time to live: 64
    Protocol: TCP (6)
    Header checksum: 0x0000 [validation disabled]
    [Header checksum status: Unverified]
    Source: 127.0.0.1
    Destination: 127.0.0.1
Transmission Control Protocol, Src Port: 8443, Dst Port: 54699, Seq: 1464, Ack: 535, Len: 38
    Source Port: 8443
    Destination Port: 54699
    [Stream index: 68]
    [TCP Segment Len: 38]
    Sequence number: 1464    (relative sequence number)
    [Next sequence number: 1502    (relative sequence number)]
    Acknowledgment number: 535    (relative ack number)
    1000 .... = Header Length: 32 bytes (8)
    Flags: 0x018 (PSH, ACK)
        000. .... .... = Reserved: Not set
        ...0 .... .... = Nonce: Not set
        .... 0... .... = Congestion Window Reduced (CWR): Not set
        .... .0.. .... = ECN-Echo: Not set
        .... ..0. .... = Urgent: Not set
        .... ...1 .... = Acknowledgment: Set
        .... .... 1... = Push: Set
        .... .... .0.. = Reset: Not set
        .... .... ..0. = Syn: Not set
        .... .... ...0 = Fin: Not set
        [TCP Flags: ·······AP···]
    Window size value: 6371
    [Calculated window size: 407744]
    [Window size scaling factor: 64]
    Checksum: 0xfe4e [unverified]
    [Checksum Status: Unverified]
    Urgent pointer: 0
    Options: (12 bytes), No-Operation (NOP), No-Operation (NOP), Timestamps
        TCP Option - No-Operation (NOP)
            Kind: No-Operation (1)
        TCP Option - No-Operation (NOP)
            Kind: No-Operation (1)
        TCP Option - Timestamps: TSval 1333672929, TSecr 1333672927
            Kind: Time Stamp Option (8)
            Length: 10
            Timestamp value: 1333672929
            Timestamp echo reply: 1333672927
    [SEQ/ACK analysis]
        [iRTT: 0.000102000 seconds]
        [Bytes in flight: 38]
        [Bytes sent since last PSH flag: 38]
    [Timestamps]
        [Time since first frame in this TCP stream: 0.179729000 seconds]
        [Time since previous frame in this TCP stream: 0.002851000 seconds]
    TCP payload (38 bytes)
    [PDU Size: 9]
Transport Layer Security
    TLSv1.2 Record Layer: Application Data Protocol: http2
        Content Type: Application Data (23)
        Version: TLS 1.2 (0x0303)
        Length: 33
        Encrypted Application Data: 0000000000000002f65d6f29617308587a3800fe771ecf9c…
HyperText Transfer Protocol 2
    Stream: SETTINGS, Stream ID: 0, Length 0
        Length: 0
        Type: SETTINGS (4)
        Flags: 0x01
            .... ...1 = ACK: True
            0000 000. = Unused: 0x00
        0... .... .... .... .... .... .... .... = Reserved: 0x0
        .000 0000 0000 0000 0000 0000 0000 0000 = Stream Identifier: 0

Frame 201: 100 bytes on wire (800 bits), 100 bytes captured (800 bits) on interface 0
    Interface id: 0 (lo0)
        Interface name: lo0
    Encapsulation type: NULL/Loopback (15)
    Arrival Time: Jul 25, 2019 22:33:37.799416000 CEST
    [Time shift for this packet: 0.000000000 seconds]
    Epoch Time: 1564086817.799416000 seconds
    [Time delta from previous captured frame: 0.006654000 seconds]
    [Time delta from previous displayed frame: 1.809988000 seconds]
    [Time since reference or first frame: 17.063378000 seconds]
    Frame Number: 201
    Frame Length: 100 bytes (800 bits)
    Capture Length: 100 bytes (800 bits)
    [Frame is marked: False]
    [Frame is ignored: False]
    [Protocols in frame: null:ip:tcp:tls:http2]
    [Coloring Rule Name: HTTP]
    [Coloring Rule String: http || tcp.port == 80 || http2]
Null/Loopback
    Family: IP (2)
Internet Protocol Version 4, Src: 127.0.0.1, Dst: 127.0.0.1
    0100 .... = Version: 4
    .... 0101 = Header Length: 20 bytes (5)
    Differentiated Services Field: 0x00 (DSCP: CS0, ECN: Not-ECT)
        0000 00.. = Differentiated Services Codepoint: Default (0)
        .... ..00 = Explicit Congestion Notification: Not ECN-Capable Transport (0)
    Total Length: 96
    Identification: 0x0000 (0)
    Flags: 0x4000, Don't fragment
        0... .... .... .... = Reserved bit: Not set
        .1.. .... .... .... = Don't fragment: Set
        ..0. .... .... .... = More fragments: Not set
        ...0 0000 0000 0000 = Fragment offset: 0
    Time to live: 64
    Protocol: TCP (6)
    Header checksum: 0x0000 [validation disabled]
    [Header checksum status: Unverified]
    Source: 127.0.0.1
    Destination: 127.0.0.1
Transmission Control Protocol, Src Port: 54699, Dst Port: 8443, Seq: 535, Ack: 1502, Len: 44
    Source Port: 54699
    Destination Port: 8443
    [Stream index: 68]
    [TCP Segment Len: 44]
    Sequence number: 535    (relative sequence number)
    [Next sequence number: 579    (relative sequence number)]
    Acknowledgment number: 1502    (relative ack number)
    1000 .... = Header Length: 32 bytes (8)
    Flags: 0x018 (PSH, ACK)
        000. .... .... = Reserved: Not set
        ...0 .... .... = Nonce: Not set
        .... 0... .... = Congestion Window Reduced (CWR): Not set
        .... .0.. .... = ECN-Echo: Not set
        .... ..0. .... = Urgent: Not set
        .... ...1 .... = Acknowledgment: Set
        .... .... 1... = Push: Set
        .... .... .0.. = Reset: Not set
        .... .... ..0. = Syn: Not set
        .... .... ...0 = Fin: Not set
        [TCP Flags: ·······AP···]
    Window size value: 6356
    [Calculated window size: 406784]
    [Window size scaling factor: 64]
    Checksum: 0xfe54 [unverified]
    [Checksum Status: Unverified]
    Urgent pointer: 0
    Options: (12 bytes), No-Operation (NOP), No-Operation (NOP), Timestamps
        TCP Option - No-Operation (NOP)
            Kind: No-Operation (1)
        TCP Option - No-Operation (NOP)
            Kind: No-Operation (1)
        TCP Option - Timestamps: TSval 1333674733, TSecr 1333672929
            Kind: Time Stamp Option (8)
            Length: 10
            Timestamp value: 1333674733
            Timestamp echo reply: 1333672929
    [SEQ/ACK analysis]
        [iRTT: 0.000102000 seconds]
        [Bytes in flight: 44]
        [Bytes sent since last PSH flag: 44]
    [Timestamps]
        [Time since first frame in this TCP stream: 1.989717000 seconds]
        [Time since previous frame in this TCP stream: 1.809958000 seconds]
    TCP payload (44 bytes)
    [PDU Size: 15]
Transport Layer Security
    TLSv1.2 Record Layer: Application Data Protocol: http2
        Content Type: Application Data (23)
        Version: TLS 1.2 (0x0303)
        Length: 39
        Encrypted Application Data: 000000000000000650806c755b2dc3ee3326598797511cb9…
HyperText Transfer Protocol 2
    Stream: HEADERS, Stream ID: 5, Length 6, GET /
        Length: 6
        Type: HEADERS (1)
        Flags: 0x05
            .... ...1 = End Stream: True
            .... .1.. = End Headers: True
            .... 0... = Padded: False
            ..0. .... = Priority: False
            00.0 ..0. = Unused: 0x00
        0... .... .... .... .... .... .... .... = Reserved: 0x0
        .000 0000 0000 0000 0000 0000 0000 0101 = Stream Identifier: 5
        [Pad Length: 0]
        Header Block Fragment: 8284c087bfbe
        [Header Length: 142]
        [Header Count: 6]
        Header: :method: GET
            Name Length: 7
            Name: :method
            Value Length: 3
            Value: GET
            :method: GET
            [Unescaped: GET]
            Representation: Indexed Header Field
            Index: 2
        Header: :path: /
            Name Length: 5
            Name: :path
            Value Length: 1
            Value: /
            :path: /
            [Unescaped: /]
            Representation: Indexed Header Field
            Index: 4
        Header: :authority: localhost:8443
            Name Length: 10
            Name: :authority
            Value Length: 14
            Value: localhost:8443
            :authority: localhost:8443
            [Unescaped: localhost:8443]
            Representation: Indexed Header Field
            Index: 64
        Header: :scheme: https
            Name Length: 7
            Name: :scheme
            Value Length: 5
            Value: https
            :scheme: https
            [Unescaped: https]
            Representation: Indexed Header Field
            Index: 7
        Header: accept-encoding: gzip
            Name Length: 15
            Name: accept-encoding
            Value Length: 4
            Value: gzip
            accept-encoding: gzip
            [Unescaped: gzip]
            Representation: Indexed Header Field
            Index: 63
        Header: user-agent: okhttp/3.13.1
            Name Length: 10
            Name: user-agent
            Value Length: 13
            Value: okhttp/3.13.1
            user-agent: okhttp/3.13.1
            [Unescaped: okhttp/3.13.1]
            Representation: Indexed Header Field
            Index: 62

Frame 219: 100 bytes on wire (800 bits), 100 bytes captured (800 bits) on interface 0
    Interface id: 0 (lo0)
        Interface name: lo0
    Encapsulation type: NULL/Loopback (15)
    Arrival Time: Jul 25, 2019 22:33:39.801761000 CEST
    [Time shift for this packet: 0.000000000 seconds]
    Epoch Time: 1564086819.801761000 seconds
    [Time delta from previous captured frame: 0.001230000 seconds]
    [Time delta from previous displayed frame: 2.002345000 seconds]
    [Time since reference or first frame: 19.065723000 seconds]
    Frame Number: 219
    Frame Length: 100 bytes (800 bits)
    Capture Length: 100 bytes (800 bits)
    [Frame is marked: False]
    [Frame is ignored: False]
    [Protocols in frame: null:ip:tcp:tls:http2]
    [Coloring Rule Name: HTTP]
    [Coloring Rule String: http || tcp.port == 80 || http2]
Null/Loopback
    Family: IP (2)
Internet Protocol Version 4, Src: 127.0.0.1, Dst: 127.0.0.1
    0100 .... = Version: 4
    .... 0101 = Header Length: 20 bytes (5)
    Differentiated Services Field: 0x00 (DSCP: CS0, ECN: Not-ECT)
        0000 00.. = Differentiated Services Codepoint: Default (0)
        .... ..00 = Explicit Congestion Notification: Not ECN-Capable Transport (0)
    Total Length: 96
    Identification: 0x0000 (0)
    Flags: 0x4000, Don't fragment
        0... .... .... .... = Reserved bit: Not set
        .1.. .... .... .... = Don't fragment: Set
